{
  "schemaVersion": "masthead-page-revision-v1",
  "kind": "session_dossier",
  "title": "Ship portable Page contract",
  "summary": "Locked the portable Page revision contract, object identity, and publish envelopes for local and hosted runtimes.",
  "body": {
    "purpose": "Share one compatibility bundle across Masthead and Masthead Pages.",
    "outcome": "Strict PageRevisionV1 decoding and RFC 8785 object IDs are available as a package.",
    "keyWork": [
      "Defined PageRevisionV1 and publish DTOs",
      "Rejected unknown fields and duplicate JSON keys",
      "Computed sha256 object IDs from canonical bytes"
    ],
    "decisions": [
      "JSON Schema is the portable contract source",
      "idempotencyKey is the only safe cross-repo correlation key"
    ],
    "blockers": [
      "Hosted persistence is still pending"
    ],
    "continuation": {
      "nextStep": "Render one immutable fixture for humans and agents",
      "openQuestions": [
        "Which social image layout ships first?"
      ],
      "constraints": [
        "No raw transcripts in public Pages"
      ]
    },
    "warnings": [
      "Evidence is publisher-selected and bounded"
    ]
  },
  "labels": {
    "topics": ["public-alpha", "contracts"],
    "technologies": ["typescript", "cloudflare-workers"]
  },
  "verification": {
    "status": "passed",
    "summary": "Contract tests cover decode, identity, and management DTOs.",
    "checks": [
      "npm test -- tests/contract --run",
      "npm run typecheck"
    ],
    "failures": []
  },
  "evidence": [
    {
      "id": "evidence-1",
      "kind": "excerpt",
      "label": "Acceptance note",
      "text": "Unknown fields are rejected before object identity is computed.",
      "supports": ["decisions", "key-work"]
    },
    {
      "id": "evidence-2",
      "kind": "verification",
      "label": "Test command",
      "text": "npm test -- tests/contract --run",
      "supports": ["verification"]
    }
  ],
  "provenance": {
    "sourceKind": "session_dossier",
    "sourceSchema": "canonical-session-dossier-v1",
    "sourceDate": "2026-08-11",
    "sourceLinks": [
      {
        "rel": "repository",
        "label": "masthead-pages",
        "url": "https://github.com/MayberryDT/masthead-pages"
      },
      {
        "rel": "commit",
        "label": "contract baseline",
        "url": "https://github.com/MayberryDT/masthead-pages/commit/0000000000000000000000000000000000000001"
      }
    ]
  },
  "license": "cc-by-4.0",
  "generator": {
    "name": "Masthead",
    "version": "0.1.15",
    "projection": "session-dossier-public-v1"
  }
}
