{
  "schemaVersion": "masthead-page-revision-v1",
  "kind": "session_dossier",
  "title": "Minimal public Page",
  "summary": "A minimal valid session dossier projection for contract tests.",
  "body": {
    "keyWork": [],
    "decisions": [],
    "blockers": [],
    "continuation": {
      "openQuestions": [],
      "constraints": []
    },
    "warnings": []
  },
  "labels": {
    "topics": [],
    "technologies": []
  },
  "verification": {
    "status": "unknown",
    "summary": "No verification claims were published.",
    "checks": [],
    "failures": []
  },
  "evidence": [],
  "provenance": {
    "sourceKind": "session_dossier",
    "sourceSchema": "canonical-session-dossier-v1",
    "sourceLinks": []
  },
  "license": "all-rights-reserved",
  "generator": {
    "name": "Masthead",
    "version": "0.1.15",
    "projection": "session-dossier-public-v1"
  }
}
